{
  "$schema": "https://json-schema.org/draft/2020-12/schema",
  "$id": "intelligence_profile.v1",
  "title": "Intelligence Profile",
  "description": "A versioned, declarative policy bundle describing one Lighthouse intelligence mission. NOT a plugin: a profile may never declare arbitrary executable modules or shell commands. This document is a human/Gateway-facing contract reference; the authoritative enforcer is modules/profiles.py (dataclass validate()).",
  "type": "object",
  "required": [
    "schema_version",
    "profile_id",
    "profile_version",
    "display_name",
    "status",
    "backup_policy"
  ],
  "additionalProperties": true,
  "properties": {
    "schema_version": {
      "type": "integer",
      "minimum": 1,
      "maximum": 1,
      "description": "Contract version. Unknown/future versions fail closed."
    },
    "profile_id": {
      "type": "string",
      "pattern": "^[a-z][a-z0-9_]*$",
      "description": "Stable, machine-safe identifier."
    },
    "profile_version": {"type": "integer", "minimum": 1},
    "display_name": {"type": "string", "minLength": 1},
    "description": {"type": "string"},
    "mission": {"type": "string"},
    "status": {
      "type": "string",
      "enum": ["draft", "experimental", "ready_for_validation"],
      "description": "Maturity. There is deliberately no 'production' or 'active' status."
    },
    "compatibility": {
      "type": "object",
      "description": "Deployment compatibility. Unknown keys fail closed.",
      "additionalProperties": true,
      "propertyNames": {
        "enum": [
          "min_schema_version",
          "max_schema_version",
          "requires_data_boundary",
          "start9_min_version",
          "lighthouse_min_version",
          "platforms",
          "notes"
        ]
      }
    },
    "source_policy": {"type": "object"},
    "collector_policy": {"type": "object"},
    "observation_policy": {"type": "object"},
    "graph_policy": {"type": "object"},
    "correlation_policy": {"type": "object"},
    "temporal_policy": {"type": "object"},
    "privacy_policy": {
      "type": "object",
      "description": "local_only:true marks a private profile; such a profile may not enable public_publishing.",
      "properties": {
        "local_only": {"type": "boolean"},
        "external_model_calls": {"type": "boolean"},
        "raw_content_export": {"type": "boolean"}
      }
    },
    "publishing_policy": {
      "type": "object",
      "properties": {
        "public_publishing": {"type": "boolean"},
        "gated_correlations_only": {"type": "boolean"},
        "requires_operator_approval": {"type": "boolean"},
        "disclosure_package": {"type": "boolean"}
      }
    },
    "backup_policy": {
      "type": "object",
      "required": ["backup_required_on_activation"],
      "properties": {
        "backup_required_on_activation": {"type": "boolean"},
        "data_root": {
          "type": "string",
          "description": "If present, must canonically resolve under the /data boundary."
        }
      }
    },
    "interface_policy": {"type": "object"},
    "dead_mans_switch_policy": {
      "type": "object",
      "description": "Declarative eligibility only. eligible defaults false; enrollment/activation fields (enrolled, activated, active, enabled, armed, scheduled) may never be truthy.",
      "properties": {
        "eligible": {"type": "boolean"}
      }
    },
    "metadata": {"type": "object"}
  },
  "$comment": "Policy blocks may not contain executable-intent keys at any depth: module(s), command, cmd, shell, exec, entrypoint, eval, script, run, callable, import, subprocess. This structural rule is enforced by modules/profiles.py, not expressible cleanly here."
}
